{
  "schema_version": "workbench-plugin-request/v1",
  "request_id": "plugreq_installnotifier01",
  "request_digest": "sha256:ee32abd10f6f88ed1482c80cee9ea0c5dafdf546f85a445a3f4b4882ec5a69b5",
  "kind": "install",
  "actor": {
    "actor_id": "operator-01",
    "kind": "operator"
  },
  "plugin": {
    "plugin_id": "deploy-notifier",
    "plugin_digest": "sha256:5474ca8eb2d41d767772c8a5ba33a1e90f5cb57017c4c8ab6487bd8ee6ba8dbb"
  },
  "lifecycle": {
    "target_version": "1.0.0"
  },
  "approval": {
    "grant_id": "approval_installnotifier01",
    "action": "install_plugin",
    "payload_hash": "sha256:58784b94dabd06c239d9b19841e39c9e0f9a0fef412bd10bc94812df5ca8838f"
  },
  "preview_ref": {
    "preview_id": "plugprev_installnotifier01"
  },
  "created_at": "2026-07-20T12:00:00Z"
}
